{
  "schemaVersion": "meta-ads-tracker-recovery-promotion/v1",
  "promotionHash": "571a62de39e076dee43069bc401b6ad0b9c5b8bc1f2ec7e14b0bd7b4bf340c50",
  "generatedAt": "2026-08-29T06:56:41Z",
  "recoveryHash": "c74fd7be3740fd2de6aae8ee55cf7817436a320f407c8a4ecbf8d96e7888f7be",
  "recoveryGeneratedAt": "2026-08-29T03:03:02Z",
  "cutoffAt": "2026-08-28T09:00:00Z",
  "week": {
    "startDate": "2026-08-24",
    "endDate": "2026-08-30",
    "label": "2026-08-24〜2026-08-30"
  },
  "recoveryReason": "missing_pre_cutoff_coverage",
  "missingPreCutoffDates": [
    "2026-08-28"
  ],
  "items": [
    {
      "id": "meta-business-sdk-releases-7ee49cbac0f6489b4f54",
      "eventId": "meta-business-sdk-releases-7ee49cbac0f6489b4f54",
      "subjectId": "meta-business-sdk-releases-9cb955fdc74bf5ea",
      "revision": "68ef116138484b4240900a05982c0290e8f5d714566ca69e7c6ff449b94a119a",
      "sourceFingerprint": "68ef116138484b4240900a05982c0290e8f5d714566ca69e7c6ff449b94a119a",
      "detectedAt": "2026-08-26T01:59:37Z",
      "changeType": "sdk_release",
      "sourceId": "meta-business-sdk-releases",
      "title": "v26.0.1",
      "officialUrl": "https://github.com/facebook/facebook-nodejs-business-sdk/releases/tag/v26.0.1",
      "priority": "standard",
      "announcementDate": {
        "status": "stated",
        "value": "2026-08-25"
      },
      "effectiveDate": {
        "status": "not_stated",
        "value": null
      },
      "rollout": {
        "status": "not_stated",
        "value": null
      },
      "targets": {
        "status": "not_stated",
        "value": null
      },
      "businessImpact": {
        "status": "not_stated",
        "summary": null,
        "assessmentSource": null
      },
      "action": {
        "status": "not_stated",
        "summary": null,
        "assessmentSource": null
      },
      "reviewStatus": "pending",
      "sourceContext": "**Full Changelog**: https://github.com/facebook/facebook-nodejs-business-sdk/compare/v26.0.0...v26.0.1",
      "originCandidateHash": "e1ac94c3f77b993c9a094165f1d1eda3f1acc9a90b4b9d8e70612b21004385fc"
    },
    {
      "id": "meta-product-news-rss-37770f7f2e6bf85cc6c2",
      "eventId": "meta-product-news-rss-37770f7f2e6bf85cc6c2",
      "subjectId": "meta-product-news-rss-6c94e51f6f97aa47",
      "revision": "7d12785ada0d2210865b729bacfc7ac05c52ecdeaf06e8ab2581755b437bc6ef",
      "sourceFingerprint": "7d12785ada0d2210865b729bacfc7ac05c52ecdeaf06e8ab2581755b437bc6ef",
      "detectedAt": "2026-08-26T01:59:37Z",
      "changeType": "new_url",
      "sourceId": "meta-product-news-rss",
      "title": "New Account Security Features for WhatsApp",
      "officialUrl": "https://about.fb.com/news/2026/08/new-account-security-features-for-whatsapp/",
      "priority": "standard",
      "announcementDate": {
        "status": "stated",
        "value": "2026-08-25"
      },
      "effectiveDate": {
        "status": "not_stated",
        "value": null
      },
      "rollout": {
        "status": "not_stated",
        "value": null
      },
      "targets": {
        "status": "not_stated",
        "value": null
      },
      "businessImpact": {
        "status": "not_stated",
        "summary": null,
        "assessmentSource": null
      },
      "action": {
        "status": "not_stated",
        "summary": null,
        "assessmentSource": null
      },
      "reviewStatus": "pending",
      "sourceContext": "On WhatsApp, your conversations belong only to you and the people you’re talking to. It’s why we built end-to-end encryption by default, and it’s why we continue adding new ways to keep your account secure and in your hands. Here are a few we’ve been working on. Two-Step Verification Is Setting Stronger Two-step verification is an extra protection layer that helps prevent someone from taking over your account, even if they get a hold of your one-time passcode. Until now, it was a six-digit PIN, but we’ve upgraded it to a full password: longer, alphanumeric, and even with special characters to make it harder to guess. More Context Before You Pick Up When you get a call from someone who isn’t saved in your contacts, a little context can help you decide whether to pick up. On Android, you’ll now see more information about a non-contact caller, like whether the number is from a different country and if you have any groups in common. Scammers rely on urgency — now you can take a beat with some more info before answering. 1 Billion People Are Using Passkeys A passkey lets you log back into WhatsApp with your fingerprint, face ID, or screen lock code. It’s the fastest and most secure way to verify it’s really you, with no codes or PINs. More than a billion people have already set one up, and you can now add more than one passkey to your account if you use both Android and iOS devices. To get started, go to Settings > Account > Passkeys. We’ll keep building tools that help you stay in control of your account and boost account security. The post New Account Security Features for WhatsApp appeared first on Meta Newsroom .",
      "originCandidateHash": "e1ac94c3f77b993c9a094165f1d1eda3f1acc9a90b4b9d8e70612b21004385fc"
    }
  ],
  "approvalRefs": [
    {
      "recoveryHash": "c74fd7be3740fd2de6aae8ee55cf7817436a320f407c8a4ecbf8d96e7888f7be",
      "eventId": "meta-business-sdk-releases-7ee49cbac0f6489b4f54",
      "revision": "68ef116138484b4240900a05982c0290e8f5d714566ca69e7c6ff449b94a119a",
      "sourceFingerprint": "68ef116138484b4240900a05982c0290e8f5d714566ca69e7c6ff449b94a119a",
      "originCandidateHash": "e1ac94c3f77b993c9a094165f1d1eda3f1acc9a90b4b9d8e70612b21004385fc",
      "reviewStatus": "approved",
      "reviewer": "ysmsnsmr",
      "reviewedAt": "2026-08-29T05:38:06Z",
      "priority": "standard",
      "businessImpact": {
        "status": "human_assessed",
        "summary": "人間確認の結果、情報として監視するが現時点の広告運用への対応は不要と判断しました。",
        "assessmentSource": "human_review"
      },
      "action": {
        "status": "not_required",
        "summary": "現時点での追加対応は不要です。今後の公式更新を監視します。",
        "assessmentSource": "human_review"
      }
    },
    {
      "recoveryHash": "c74fd7be3740fd2de6aae8ee55cf7817436a320f407c8a4ecbf8d96e7888f7be",
      "eventId": "meta-product-news-rss-37770f7f2e6bf85cc6c2",
      "revision": "7d12785ada0d2210865b729bacfc7ac05c52ecdeaf06e8ab2581755b437bc6ef",
      "sourceFingerprint": "7d12785ada0d2210865b729bacfc7ac05c52ecdeaf06e8ab2581755b437bc6ef",
      "originCandidateHash": "e1ac94c3f77b993c9a094165f1d1eda3f1acc9a90b4b9d8e70612b21004385fc",
      "reviewStatus": "approved",
      "reviewer": "ysmsnsmr",
      "reviewedAt": "2026-08-29T05:38:06Z",
      "priority": "standard",
      "businessImpact": {
        "status": "human_assessed",
        "summary": "人間確認の結果、情報として監視するが現時点の広告運用への対応は不要と判断しました。",
        "assessmentSource": "human_review"
      },
      "action": {
        "status": "not_required",
        "summary": "現時点での追加対応は不要です。今後の公式更新を監視します。",
        "assessmentSource": "human_review"
      }
    }
  ],
  "publicationEligible": true
}
